{
  "id": "evidence-shein-consumer-information-fine-2026",
  "source_id": "source-senat-shein-dgccrf-2026",
  "locator": "Réponse du ministère publiée le 10 septembre 2026, paragraphes sur la sanction de 22,4 millions d'euros",
  "summary": "Le ministère indique qu'au début de juin 2026 la DGCCRF a infligé à SHEIN une amende de 22,4 millions d'euros en raison d'informations essentielles manquantes dans les confirmations de commande, du non-respect du droit de rétractation et d'informations réglementaires environnementales absentes.",
  "supports_claim_ids": [
    "claim-shein-consumer-information-fine-2026"
  ],
  "limitations": "Résumé officiel des manquements, à distinguer de la description détaillée de la décision administrative."
}
