{
  "id": "evidence-efsa-food-contact-microplastics-2025",
  "source_id": "source-efsa-food-contact-microplastics-review-2025",
  "locator": "EFSA Supporting Publications, EN-9733, résumé, publié le 21 octobre 2025",
  "summary": "La revue structurée de l'EFSA conclut qu'il existe des éléments montrant une libération de microplastiques lors de l'utilisation de matériaux au contact des aliments. Les mécanismes identifiés comprennent notamment les contraintes mécaniques telles que l'abrasion et le frottement, ainsi que les matériaux à structure ouverte ou fibreuse. L'EFSA précise toutefois que les quantités effectivement libérées sont bien inférieures à celles rapportées dans de nombreuses publications et qu'il n'existe pas de base suffisante pour estimer l'exposition issue de ces matériaux.",
  "limitations": "La revue signale des faiblesses méthodologiques, des risques d'identification et de comptage erronés et des lacunes de données importantes. Elle porte sur les matériaux au contact des aliments en général et ne démontre pas une migration depuis les sachets Gerber examinés par Greenpeace ou Consumer Reports."
}
