{
  "id": "evidence-fda-microplastics-health-uncertainty-2026",
  "source_id": "source-fda-microplastics-food-guidance-2026",
  "locator": "FDA, sections « Key Points », « Microplastics and Nanoplastics in Foods » et « Health Effects Information », consultées le 30 octobre 2026",
  "summary": "La FDA indique que les microplastiques peuvent être présents dans les aliments, notamment à la suite d'une contamination environnementale. Elle précise que les données scientifiques actuelles ne démontrent pas que les niveaux détectés dans les aliments présentent un risque pour la santé humaine et qu'il n'existe pas de preuves scientifiques suffisantes pour établir une migration des microplastiques depuis les emballages alimentaires vers les aliments. Elle souligne aussi l'absence de méthodes standardisées et les limites de précision et de spécificité de certaines études.",
  "limitations": "Position générale de la FDA, non spécifique au produit Gerber étudié. Elle ne démontre ni l'absence de particules dans les échantillons analysés ni l'innocuité de chaque produit ou lot. Les connaissances et méthodes évoluent ; la FDA indique poursuivre la surveillance scientifique."
}
