{
  "id": "evidence-shein-france-pcn-2025",
  "source_id": "source-france-pcn-shein-2025",
  "locator": "Communiqué final du PCN français du 18 septembre 2025, synthèse des constats et recommandations",
  "summary": "Le PCN constate des non-conformités dans la mise en œuvre de la politique de conduite responsable de SHEIN, portant notamment sur la gestion de la chaîne d'approvisionnement, l'identification, la prévention, l'atténuation et la réparation des impacts sociaux et environnementaux, ainsi que sur la transparence de la gouvernance et des informations financières.",
  "supports_claim_ids": [
    "claim-shein-france-pcn-nonconformities-2025"
  ],
  "limitations": "Constat et recommandations d'un mécanisme non judiciaire. SHEIN conteste l'analyse ; le PCN prévoit un suivi de ses recommandations."
}
