{
  "id": "evidence-nestle-water-cjipe",
  "source_id": "source-justice-2024-cjipe-nestle",
  "locator": "Convention judiciaire d'intérêt public environnementale du 2 septembre 2024 ; dispositions relatives à l'amende et aux mesures de réparation",
  "summary": "La convention publiée par le ministère de la Justice formalise l'accord conclu entre le parquet d'Épinal et Nestlé Waters Supply Est. Le communiqué de l'entreprise du 10 septembre 2024 indique une amende d'intérêt public de deux millions d'euros.",
  "supports_claim_ids": [
    "claim-nestle-water-cjipe"
  ],
  "limitations": "La convention concerne la société Nestlé Waters Supply Est et son périmètre judiciaire dans les Vosges."
}
