{
  "id": "evidence-consumer-reports-gerber-microplastics-2026",
  "source_id": "source-consumer-reports-baby-food-testing-2026",
  "locator": "Consumer Reports, « Microplastics Are Highly Common in Packaged Baby Foods », tableau « Microplastic Particles per Serving », entrée Gerber Organic Plant Protein Banana Berry and Veggie Smash Purée with Oats ; sections « How We Tested Baby Food » et « Gerber »",
  "summary": "Consumer Reports rapporte 728 294 particules microplastiques par portion de 99 g pour la purée Gerber Organic Plant Protein Banana Berry and Veggie Smash Purée with Oats. Pour l'ensemble de l'enquête, Consumer Reports indique avoir testé 48 produits de 11 marques, en deux à quatre lots par produit auprès d'un laboratoire externe accrédité. Le sous-échantillon microplastiques comprenait 15 purées et un jus, également en deux à quatre lots par produit ; l'article rapporte des particules dans les 15 purées et aucune détection dans le jus Gerber testé.",
  "limitations": "Résultat d'une enquête de tests de produits, non d'une étude clinique. La FDA a précisé ne pas avoir examiné les méthodes, les données brutes ou les rapports analytiques de cette enquête. Consumer Reports n'a pas analysé la composition plastique de l'emballage et cite plusieurs sources possibles de contamination, notamment les emballages, les machines, les outils et les équipements de protection. Les échantillons ont été choisis selon les exigences du laboratoire (échantillons pouvant être broyés uniformément et liquides clairs). Les résultats sont un instantané des produits et lots testés ; ils ne permettent pas de généraliser à tous les produits Gerber ni d'établir un effet sanitaire."
}
