{
  "id": "evidence-efsa-microplastics-risk-status-2026",
  "source_id": "source-efsa-microplastics-food-risk-status-2026",
  "locator": "EFSA, page « Microplastics and nanoplastics in food », sections « Latest » et FAQ, page révisée le 21 octobre 2026",
  "summary": "L'EFSA indique ne pas avoir encore achevé une évaluation complète des risques liés aux microplastiques et nanoplastiques dans les aliments et ne pas pouvoir conclure à ce stade sur les effets potentiels pour la santé. Un avis scientifique sur les risques potentiels dans les aliments, l'eau et l'air est en préparation, avec une finalisation prévue d'ici la fin de 2027.",
  "limitations": "Il s'agit de l'état des travaux de l'EFSA au 21 octobre 2026, et non d'une conclusion définitive sur l'innocuité ou la dangerosité des microplastiques ni d'une évaluation des produits Gerber."
}
