{
  "id": "evidence-nestle-bms-marketing-company-response",
  "source_id": "source-nestle-non-financial-statement-2024-bms",
  "locator": "Non-Financial Statement 2024, pages 96-97, section « Nestlé's non-compliance »",
  "summary": "Nestlé rapporte 186 cas de non-conformité à sa propre politique en 2024, dont 26 attribués à l'entreprise et 160 à des tiers contractuels. Le rapport indique qu'ATNi n'a relevé aucun cas au regard de la politique Nestlé ou du droit local dans les cinq pays étudiés.",
  "excerpt": "No instance of non-compliance was identified in relation to the Policy or local regulation.",
  "limitations": "Il s'agit de chiffres et d'une interprétation publiés par Nestlé. Les critères et périmètres diffèrent de ceux du BMS Index d'ATNi, qui mesure l'alignement avec le Code international de l'OMS.",
  "contradicts_claim_ids": []
}
