{
  "id": "evidence-nestle-bms-marketing-atni-2024",
  "source_id": "source-atni-bms-index-2024-nestle",
  "locator": "Fiche Nestlé, BMS Index 2024, Country Studies overview et Main in-country findings",
  "summary": "ATNi recense 219 incidences dans les cinq marchés étudiés : 109 observations en ligne, 85 sur les étiquettes et 25 dans les médias traditionnels. Les observations sont réparties entre Chine, Allemagne, Indonésie, États-Unis et Viet Nam.",
  "excerpt": "A total of 219 incidences of non-compliance were found for Nestlé.",
  "limitations": "Les résultats portent sur les pratiques observées dans les cinq marchés et sur l'alignement avec le Code de l'OMS, pas sur une qualification judiciaire ou la légalité au regard du droit national.",
  "supports_claim_ids": [
    "claim-nestle-bms-marketing-atni-2024"
  ]
}
