{
  "id": "evidence-rappelconso-guigoz-powder-2026",
  "source_id": "source-rappelconso-guigoz-powder-2026",
  "locator": "Fiche 2026-01-0040 version 2, publiée le 7 janvier 2026 ; sections identification des produits, lots et consignes de rappel",
  "summary": "RappelConso répertorie les références Guigoz en poudre concernées, avec leurs GTIN et numéros de lots, des DDM allant du 30 novembre 2026 au 31 décembre 2027, une commercialisation jusqu'au 6 janvier 2026 et une distribution France entière. Le motif indiqué est la présence potentielle de céréulide liée à une huile ARA provenant d'un fournisseur. La fiche demande de ne plus consommer ni utiliser les lots listés, de contacter le service consommateur et de détruire le produit.",
  "supports_claim_ids": [
    "claim-nestle-infant-formula-recall-cereulide-2026"
  ],
  "limitations": "La liste des lots doit être consultée directement sur la fiche officielle ; les autres références et lots ne sont pas concernés par cette fiche."
}
